"單元小節","主題","小故事","練習題1","答案1","練習題2","答案2","練習題3","答案3","練習題4","答案4","練習題5","答案5","知識點"
"1-1","億以上的大數","在一場天文展中，老師告訴同學們：宇宙中的星星多得難以計算，像我們銀河系的恆星數量就超過了一千億顆！小澈想：哇，這就是「億」這個單位的世界啊！","10個一千萬是什麼數？","1億","5個一億是什麼數？","5億","3億加2億等於多少？","5億","4億減1億等於多少？","3億","2億乘以2等於多少？","4億","認識億以上的大數的單位意義與讀法。"
"1-2","多位小數","媽媽在超市買了一塊肉重達1.235公斤，小澈觀察電子秤的顯示數字，發現小數點後的數字有3位，媽媽說：這就是多位小數的世界。","1.235的小數部分是多少？",0.235,"0.007與0.07哪個比較大？",0.07,"0.123與0.132哪個較小？",0.123,"0.01、0.001、0.1由小到大排列","0.001 < 0.01 < 0.1","0.005的千分位是？",5,"理解並比較多位小數的大小與位置值。"
"1-3","數的十進位結構","在算珠課上，小澈學會用珠子代表千位、百位、十位，還有小數點後的十分位與百分位，發現數字其實像建積木一樣，有規律地排列著。","234.56中的十位數是？",3,"234.56的小數部分是？",0.56,"數字9876中的千位數是？",9,"小數0.407的百分位是幾？",0,"十進位的進位單位是幾？",10,"理解整數與小數的十進位結構及各位數值代表的意義。"
"1-4","十進位結構的應用","小澈和同學玩交換遊戲，10個十元可以換1個百元，100個百元可以換1個萬元，這就是十進位結構的應用，小澈越換越有成就感！","10個十元換多少元？","100元","100個百元換多少元？","10000元","5個十元與2個百元合起來是多少元？","250元","0.1元是幾分？","10分","1000元中有幾個十元？",100,"將十進位概念應用在實際生活計算與轉換中。"
"2-1","整數的分數倍","學校種樹活動，老師說我們要種的樹是學長姊的1/3，小澈發現分數倍原來是這樣計算的：整數×分數。","15的1/3是多少？",5,"24的2/3是多少？",16,"12是36的幾分之幾？","1/3","30的5/6是多少？",25,"40的3/5是多少？",24,"理解整數乘以分數即為「整數的幾分之幾」，並可反向求分數。"
"2-2","分數的分數倍 ","皮皮和多多在學校參加了一個「彩色紙張拼圖比賽」。 比賽規則是：每組要把一張黃色與藍色各占一半的紙，剪成幾份，並依照指定比例來拼成新的圖案。  皮皮拿到了「1/2 張黃紙的1/3」來設計太陽，多多則拿到了「1/2 張黃紙的1/4」來設計星星。 他們互相討論後發現：「哇！原來把一張的一部分再取一部分，就是要用乘法！」 最後，皮皮設計了一個金光閃閃的太陽，多多設計了一個小小閃亮的星星，成功贏得了比賽冠軍！","皮皮拿到1/2張紙，要取其中的1/3來使用，請問用了多少張紙？ "," 1/6","一張紙分成4份，多多用了其中的1/2，再從這部分取1/4，請問用了多少張紙？ "," 1/8","齊齊有3/5塊地，要種下2/3的部分，實際種了多少塊地？ "," 2/5","媽媽用5/8公斤的糖做糕點，每次需要用3/4，請問實際用多少公斤糖？ ","15/32 "," 小池塘長2又1/4公尺，寬3又1/5公尺，面積是多少平方公尺？（先換成假分數計算） ","7 1/5","介紹「分數的分數倍」概念：將分數的一部分再取一部分，用乘法計算。 練習分數×分數的實際應用，並觀察分子乘分子、分母乘分母的規律。分數乘分數的實際應用問題（如料理材料的計算、液體容量計算）。 分數乘分數應用到實際情境（登山步道、公園池塘的面積計算）。 更進階的應用：帶分數乘帶分數的應用題，並學習帶分數轉成假分數。"
"2-3","被乘數、乘數與積的關係 ","小樂和小芸在花園裡澆花。他們有一桶水，容量是10公升。小樂用了桶子的 3/5 來澆玫瑰，小芸用了桶子的 1/5 來澆向日葵。他們不用實際計算，只想想就知道：因為 3/5 比 1/5 大，所以小樂澆的水比較多。 他們還發現：當乘數是小於1的分數時，得到的水量（積）會比原來的水量（被乘數）少；如果乘數是大於1的數（像是 4/3），結果反而會比被乘數還要大呢！  從此以後，小樂和小芸不只學會了分數乘法，還學會了不用計算也可以大概判斷結果大小的好方法。","有一個水桶裝了12公升水，用了3/4。請問用了多少公升水？ ","9公升","一塊蛋糕，吃了 5/8，剩下多少塊？（用原本的一塊當作1） ","3/8塊","一條繩子長9公尺，剪掉 2/3，剪下來的是幾公尺？ ","6公尺","一個果汁瓶裝了6公升，喝掉了 5/6，還剩下多少公升？ ","1公升","媽媽買了 7/8 千克的草莓，用了 2/7 來做果醬，果醬用了多少千克草莓？","¼千克","理解乘數小於1或大於1時，積與被乘數的大小比較。透過表格，體會「兩數相乘，積與被乘數、乘數之間的比較關係」。當乘數<1時，積比被乘數小；當乘數>1時，積比被乘數大；當乘數=1時，積等於被乘數。思考帽問題：推論在何種情況下，積會是整數或分數。"
"2-4","分數除以整數 ","小明和小紅在學校的花園裡種植花朵，他們想知道每一個小花盆可以放入多少花。小明準備了 3/4 塊土地，打算平均分配給 3 個小花盆，他心裡想，「如果我把 3/4 塊土地平均分給 3 個花盆，那麼每個花盆會有多少土地呢？」  小紅用數學的方法幫忙算出答案，她告訴小明：「你可以把 3/4 除以 3，相當於 3/4 ÷ 3。」他們算出了每個花盆分到的土地是 1/4 塊。小明學到了「分數除以整數」的概念，覺得好有趣！","小明有 3/5 塊土地，他打算分給 2 個花盆，每個花盆分到的土地有多少？ ","3/10塊","小紅有 5/6 塊土地，他打算分給 3 個花盆，每個花盆分到的土地有多少？ ","5/18塊","小明將 2/3 塊土地平均分給 4 個花盆，每個花盆分到的土地有多少？ ","1/6塊","小紅準備了 3/5 塊土地，打算分給 5 個花盆，每個花盆分到的土地有多少？ ","3/25塊","老師有 7/8 塊土地，想分給 2 個班級，每個班級分到的土地有多少？ ","7/16塊","分數除以整數的意義：將一個分數平均分給若干份。例如，將 3/4 塊土地分給 3 個花盆，實際上就是將 3/4 除以 3。如何計算：計算分數除以整數的方法是將分數與整數的倒數相乘，即「分數 ÷ 整數 = 分數 × 整數的倒數」。實際應用：分數除以整數在生活中有很多實際應用，例如平均分配土地、食物、金錢等。"
"3-1","長方體與正方體的體積 ","皮皮和丹丹參觀了石門水庫的泥沙清除工程，看到一艘巨大的抽泥船。他們好奇地問：「這麼大一艘船，要清理多少泥沙啊？」
導覽員阿姨笑著回答：「這艘抽泥船每年可以清除超過40萬立方公尺的泥沙喔！」
皮皮驚訝地說：「哇，那是多少立方公尺呢？如果用正方體堆起來會是什麼樣子呢？」
阿姨拿出模型解說：「像這個長5公分、寬5公分、高5公分的正方體，我們叫它1立方單位。如果要堆出40萬個這樣的立方體，可是要堆成一座小山呢！」
丹丹開心地說：「原來，計算體積就是要知道物體裡可以放多少個這樣的小立方體啊！」
從此，他們學會了長方體和正方體的體積計算公式：長 × 寬 × 高！ ","一個長方體的長是6公分，寬是4公分，高是5公分。請問體積是多少立方公分？ ","120立方公分","一個正方體的邊長是7公分，請問體積是多少立方公分？ ","343立方公分","一個長方體的體積是240立方公分，長是8公分，寬是5公分，高是多少公分？ ","6公分","一個正方體積木堆成的體積是125立方公分，這個正方體的邊長是多少公分？ ","5公分","一個長方體盒子，長是12公分、寬是7公分、高是5公分。盒子的體積是多少立方公分？ ","420立方公分","認識台灣水庫淤積問題與泥沙體積的單位（立方公尺），引導到體積的概念。認識長方體結構：長、寬、高的不同排列方式。了解立方體如何由單位立方堆成。透過堆積單位立方體推導出長方體體積公式（長 × 寬 × 高），並實作算式。運用長方體與正方體的體積公式進行實際計算（含長方體與正方體例題）。延伸應用：千格塊與正方體泡棉積木體積計算練習，建立直觀空間感。"
"3-2","認識1立方公尺 ","一天，Tommy 和他的朋友們發現了一個非常大的箱子。他們想知道箱子的容量到底有多大。Tommy說：「我們可以把箱子分成小的1立方公尺的單位，這樣就能知道這個箱子有多少個1立方公尺！」大家開始幫忙計算，並逐一放入標準大小的立方體來填充這個箱子。經過努力，他們發現這個箱子的容量相當於幾十個1立方公尺的空間！他們不禁為這個大箱子的容量感到驚訝，原來1立方公尺的大小竟然如此具體而直觀！ ","一個立方體的邊長為2公尺，這個立方體的體積是多少立方公尺？ ","8立方公尺","如果將1立方公尺的箱子放入一個2立方公尺的空間，它會怎麼樣？ ","1立方公尺的箱子將完全容納進去，並且還有空間剩下。 ","將2個1立方公尺的箱子堆在一起，會有多少立方公尺的體積？ ","2立方公尺","有一個長方體，它的長是4公尺，寬是2公尺，高是3公尺。這個長方體的體積是多少？ ","24立方公尺","如果要計算1立方公尺等於多少立方厘米，應該怎麼做？ ","1立方公尺 = 100 × 100 × 100 = 1,000,000 立方厘米。 ","(1) 1立方公尺的定義：1立方公尺是邊長為1公尺的立方體的體積，簡單來說，它是容納1公尺×1公尺×1公尺空間的體積。 (2) 計算長方體體積的基本公式是： 長 × 寬 × 高 ；計算立方體體積的基本公式是：邊長 × 邊長 × 邊長。(3) 1立方公尺等於100厘米 × 100厘米 × 100厘米，也就是1,000,000立方厘米。這是進行體積單位換算時的重要公式。"
"3-3","簡單複合形體的體積 ","故事名稱：皮皮與丹丹的大積木任務。皮皮和丹丹在學校的數學課上接到了一個任務：用正方體積木和長方體積木，搭建出一個新的大型形體。他們拿著一堆大小不同的積木，討論著如何組合才能剛好填滿空間。  皮皮說：「我們可以把形體切分成上下兩層，每一層分別算體積！」 丹丹則建議：「或者左右切開，再加起來，也可以！」 於是，他們一邊量邊畫，把每個小形體的長、寬、高仔細記下來，然後分別算出每一部分的體積，再把所有體積加起來。  最後，他們成功搭建出一座壯觀的積木城堡，老師讚許他們懂得運用分割與加總法則計算複合形體體積，也讓大家了解：複合形體的體積＝各部分體積相加！","一個由兩個長方體組成的複合形體，請問總體積是多少立方公分？上層：長 5、寬 4、高 3；下層：長 8、寬 4、高 2","124立方公分","一個形體由一個正方體（邊長6公分）和一個長方體（長10公分、寬6公分、高2公分）組成。求總體積。 ","336立方公分","下面是一個有缺口的形體（如下圖示意），先補成大長方體再減去小正方體。 大長方體：長 10、寬 8、高 6 ；小正方體：邊長 4","416立方公分","一個形體分成左右兩塊，左邊是長方體（長7公分、寬5公分、高4公分），右邊是正方體（邊長4公分）。求總體積。 ","204立方公分","有一個形體，底座是長方體（長12公分、寬9公分、高5公分），上方是一個較小的正方體（邊長3公分），求總體積。 ","567立方公分","了解組合形體各部分長、寬、高之關係。切分策略（上下分、左右分）。填補法與減去法。 體積比大小應分別計算後比較。實際應用體積大小判斷。熟練組合體積計算。將複雜水域分成長方體或長方形區段測量體積。"
"4-1","多位小數乘以整數 ","皮皮和丹丹到動物園參觀，皮皮在紀念品店看到一支長2.54公分的小鉛筆。他想買12支送給班上的同學。丹丹說：「我們可以先用整數算，再移動小數點，就可以知道總長度了！」 於是他們一起計算：2.54 × 12，發現買12支鉛筆總長大約是30.48公分。 皮皮開心地說：「這樣每個同學都可以拿到一支可愛的小鉛筆了！」","0.45 × 7 等於多少？",3.15,"2.308 × 5 等於多少？",11.54,"4.025 × 6 等於多少？",24.15,"3.306 × 20 等於多少？",66.12,"7.245 × 4 等於多少？",28.98,"小數在生活中的運用，認識坪、平方公尺等單位，初步提及小數計算。小數乘以整數的筆算方法：先當整數算，最後調整小數點位置。小數乘以整數的筆算示範、移動小數點的規則，練習題示範。小數乘以10、100、1000時的小數點位移規則。"
"4-2","整數乘以小數 ","在果園裡，小樂幫忙採收柳橙。每一籃柳橙汁可榨出5公升的柳橙汁。小樂一會兒榨了0.1籃的柳橙、又榨了0.7籃、最後又榨了2.7籃。小樂興奮地計算總共榨出了多少公升的柳橙汁，並且想著：「如果把榨出的柳橙汁賣給市場，該可以賺多少錢呢？」","一桶牛奶的容量是6公升，榨了0.8桶牛奶，請問總共榨出多少公升的牛奶？列式：6 × 0.8 = （ ） ","4.8公升","小明的體重是45公斤，爸爸的體重是小明的2.3倍，請問爸爸的體重是多少公斤？列式：45 × 2.3 = （ ） ",103.5,"一包米重3公斤，媽媽買了1.6包米，請問總重量是多少公斤？列式：3 × 1.6 = （ ） ","4.8公斤","一條布長8公尺，0.25條布長多少公尺？列式：8 × 0.25 = （ ） ","2公尺","一輛卡車可以載重200公斤，如果只裝載了0.15的容量，請問裝載了多少公斤？列式：200 × 0.15 = （ ） ","30公斤","理解整數乘以小數（十分位數小數）的方法。整數乘以一位小數或一位小數的小數乘法計算。整數乘以二位數、三位數小數的方法。小數乘整數，並理解位值移動的技巧。"
"4-3","小數乘以小數 ","水管修理隊的大任務：小明參加了學校的「水管修理隊」，今天他們要計算學校地下管線總重量。每一條水管重0.1公斤，小明發現有時要算2條、0.1條，甚至0.01條水管的重量。他們還要鋪設地墊，長0.5公尺、寬0.3公尺的小地墊，需要計算面積。還有，校園裡的花圃長4.5公尺、寬1.9公尺，也要計算面積7。小明運用小數乘以小數的乘法技巧，精準地完成了所有任務，獲得全校表揚！","一條水管重0.1公斤，5條水管共重多少公斤？","0.5公斤","0.2條水管重多少公斤？ ","0.02公斤","一個長0.6公尺、寬0.4公尺的小地墊，面積是多少平方公尺？ ","0.24平方公尺","一塊花圃長2.5公尺、寬1.2公尺，面積是多少平方公尺？ ","3平方公尺","大瓶果汁是1.8公升，小瓶果汁是大瓶的0.5倍，小瓶果汁是多少公升？ ","0.9公升","小數乘以小數，特別是0.1、0.01這種分數觀念的轉換與計算。小數乘以小數求長方形面積。 小數乘以小數的倍數關係 。 觀察乘數、被乘數與積的關係，比較大小。 小數直式乘法與整數乘法的推論關係。"
"4-4","小數、整數除以整數 ","小強家要分裝砂糖。他們有一大袋0.6公斤的砂糖，要平均分成3袋。每個人負責一袋，但小明不小心把其中一袋的重量記成0.2公斤，小強仔細核對後發現：0.6 ÷ 3 = 0.2，小明其實記得對！ 隔天，媽媽準備了0.45公升的檸檬汁，要裝成5杯，每杯可以喝多少？小強用除法很快算出來：0.45 ÷ 5 = 0.09公升。 從此以後，小強成為班上最會做「小數除法」的人，幫助大家一起解決很多生活中的分配問題！","一塊奶酪重 0.8 公斤，平均分成 2份，每份是多少公斤？ ","0.4公斤","把 2.4 公尺的緞帶分成 8段，每段是幾公尺？ ","0.3公尺","小明有 9.6公斤的米，要裝進 4個袋子，每袋是多少公斤？ ","2.4公斤","一條長 6公尺的布，分成 5份，每份約是多少公尺？（四捨五入到小數點第二位） ","1.20公尺","把 3.2 公升的果汁，平均裝進 5瓶，每瓶約多少公升？（四捨五入到小數點第二位） ","0.64公升","小數除以整數，直式計算方法（一位小數、二位小數）。小數除以整數，直式計算應用題（重量、長度問題）。小數除以整數，時間轉換（分鐘轉小時），以及小數表示法。小數除以整數時遇到除不盡、取至小數點第二位的處理（四捨五入）。小數除以10、100的規律觀察（小數點位移規則）。"
"5-1","認識公噸 ","【大卡車的任務】 有一天，學校旁邊的工地要運送一批重物，總重量是4.5公噸。小偉看到一台大型小貨車，標示最大載重是1.5公噸，他好奇地問爸爸：「要用幾台小貨車才能搬完這批貨物呢？」 爸爸笑著說：「4.5 ÷ 1.5 = 3，所以要三台小貨車，才能搬完喔！」 小偉第一次知道，「公噸」這麼大，原來一公噸有1000公斤！","一台吊車的重量是2.5公噸，兩台吊車總重多少公噸？","5.0公噸","一輛卡車載重0.75公噸，4輛卡車共載重多少公噸？ ","3.0公噸","一頭非洲象重4.935公噸，兩頭非洲象共重多少公噸？ ","9.87公噸","1800公斤是幾公噸？ ","1.8公噸","一隻藍鯨的體重大約14600公斤，約多少公噸？","14.6公噸","認識面積和重量中的大數字概念。 延伸說明巨大單位的認識，引出重量的估算與推論。 介紹1公噸＝1000公斤，並進行小數、公噸的轉換與簡單應用。 學習選擇正確的重量單位（公斤、公噸）。 訓練將千位、萬位數字換算成公噸、千公斤。"
"5-2","認識公畝、公頃和平方公里 ","【小兔和小熊的大冒險】  小兔和小熊參加了森林村的地圖挑戰賽。比賽規定：  找出一片面積正好是 1公頃 的草地。  找出一片面積是 0.25平方公里 的森林。  計算森林村最大的草原（面積為 4公頃）是幾平方公尺。  小兔說：「1公頃是100公尺乘100公尺，就是一萬平方公尺！」 小熊說：「0.25平方公里是250000平方公尺，因為1平方公里是100萬平方公尺！」 他們合作完成了所有挑戰，還發現森林村最大的草原有40000平方公尺！ 小兔和小熊開心地拿到了地圖達人獎！","一片牧場的面積是2.5公頃，這片牧場的面積是幾平方公尺？ ","25000平方公尺","一座森林的面積是1.2平方公里，換算成公頃是多少？ ","120公頃","一個運動場的面積是0.4公頃，是多少平方公尺？ ","4000平方公尺","一座農場面積是36000平方公尺，是多少平方公里？ ","0.036平方公里","一片農地面積是8公頃，是多少平方公里？ ","0.08平方公里","1公畝=100平方公尺；1平方公尺=0.01公畝。面積換算：公畝與平方公尺之間的關係。公頃與平方公尺、公畝關係。公頃與平方公尺單位轉換。平方公里與平方公尺、公頃關係。加深理解平方公里、平方公尺換算。整理平方公里、公頃、公畝、平方公尺的對應關係。公頃轉換成平方公尺和平方面積換算。公頃轉換成平方公里。平方公尺轉換成公頃。場地面積選擇適合單位（公頃、公畝、平方公尺）。公頃與平方公尺轉換應用實例。"
"6-1","時間的乘法 ","【祥祥的餅乾工廠】 祥祥在餅乾工廠參觀時，看到自動化包裝機正快速運作。他驚訝地問導覽員：「一袋餅乾裝好只要18秒耶，那如果要裝144袋呢？」 導覽員笑著說：「那就用乘法算囉，18秒乘144袋，總共需要2592秒。」 祥祥快速心算：「那是43分12秒耶！」 接著，他又問：「那麼，如果爸爸上週參加手工烘焙課，一堂課是2小時25分鐘，上了8堂課，總共上了多少時間？」 祥祥拿出紙筆，不一會兒就說出：「等於19小時20分鐘！」 爸爸聽了點頭：「你真是我們家的時間小博士！」","一袋餅乾需時 18 秒，裝 144 袋需要幾秒？幾分幾秒？","2592秒；43分12秒 ","一堂課是 2 小時 25 分鐘，上 8 堂課共上多少時間？ ","19 小時 20 分鐘 ","月球繞地球一圈需 29 天 12 小時，繞 3 圈共需多久？ ","88 天 12 小時 ","1 次任務需 205 秒，完成 4 次共幾分鐘幾秒？ ","13 分 40 秒 ","福爾摩沙衛星一圈 96 分 41 秒，繞 5 圈需多少時間？ ","8 小時 3 分 25 秒 ","單位換算（時 → 分 → 秒）、時間乘法應用。日常情境中時間計算、等量關係應用。時間單位乘法計算（時分、分秒混合單位計算）。複合單位（天、時、分、秒）乘法應用與換算。"
"6-2","時間的除法 ","【阿哲的機器人時光任務】  阿哲參加學校的創客比賽，設計了一台自動送餐機器人。機器人每次充電後可以運作 1小時40分，而送一趟餐要花 8分30秒。阿哲想知道，機器人在一次充電後最多可以送幾趟餐？他開始計算：  「1小時40分等於100分鐘，100分鐘除以8.5分鐘，答案大約是11趟！」 阿哲興奮地寫下答案，準備修改程式讓機器人每次充電都發揮最大效率！  ","一首歌曲長 3分20秒，如果播放10分鐘，最多可以播幾次？ ","3次","打掃機器人充飽電後可運作 8時30分，打掃一次要花 1時40分，最多可以打掃幾次？ ","5次","自動製餅機每 30分鐘可烤 1 個蛋糕，最多烤出 50 個蛋糕需要多久？ ","25小時","氣象衛星繞地球一圈需 18小時，7天內最多可以繞幾圈？ ","9圈","工廠的機器每 5 小時可生產一箱產品，13日16小時最多可以生產幾箱？ ","65箱","時間單位的換算（分、秒）與除法應用。時間相減與除法計算的綜合應用。將日、時、分混合單位轉換並除法應用。"
"6-3","時間的應用 ","以3D列印機製作紀念品的效率變化為背景，設計出生活化情境，幫助學生理解時間乘除的應用方式，例如：「現在的列印機可以在相同時間內列印更多物品，那過去與現在一個印章所需時間差多少？」","舊列印機6個印章需10時30分，今可列印70個，1個印章的時間差多少？","差9分","1場活動1時20分，共5場，13時開始，結束是幾點幾分？
","17時40分","鬼屋10時40分到14時，每50分入100人，共幾人入場？ ","400人","電影院11時20分播第1場，每場2時，休息20分，第5場播出時間？ ","19時40分","2台機9日可產1800盒，改3台同時作業，需要幾日？ ","6日","時間的應用（列印機效率與時間差的計算）。使用時間軸解題，計算活動總時長與參與人數。合併場次時間與休息時間，進行時間累加的應用計算。工程問題（改變機器數量與工作天數），屬於「反向比例」概念。"
"7-1","認識容積 ","【水塔與寶特瓶的秘密】  皮皮在院子裡看著水塔發呆，他問媽媽：「台灣水資源這麼珍貴，為什麼我們水費好便宜？」  媽媽微笑著說：「你知道嗎？一度水是1000公升，差不多能裝1000個寶特瓶！所以雖然水源珍貴，但台灣水價全球偏低。」  皮皮驚訝地張大嘴：「哇，那水塔裡一定能裝超多寶特瓶耶！」於是，他們開始用紙箱和寶特瓶模擬容器的內部空間，學會了什麼是「容積」。","一個長方體箱子的內部長為 4 公尺、寬為 3 公尺、高為 2 公尺，這個箱子的容積是多少立方公尺？ ","24立方公尺","如果一個容器可以裝下 27 個 1 立方公分的積木，那這個容器的容積是多少立方公分？ ","27立方公分","皮皮爸爸公司租用貨櫃運貨，貨櫃內部長為 6 公尺，寬為 2.5 公尺，高為 2 公尺，容積是多少立方公尺？ ","30立方公尺","住在國外的阿姨蓋了一個儲藏室，內部尺寸為：長 2 公尺，寬 3.2 公尺，高 3 公尺，容積是多少？ ","19.2立方公尺","一個長方體箱子外部尺寸為長 12 公分、寬 9 公分、高 10 公分，板材厚度為 1 公分，問內部容積為多少立方公分？ ","560立方公分","「1度水 = 1000公升」與生活中常見容器的對應關係。容積的定義：容器內部可容納的最大空間。容器之間的比較方式：使用同樣積木或單位立方體裝入判斷空間大小。規則容器的容積＝長 × 寬 × 高。實際應用容積：貨櫃、儲藏室、展示櫃。外部尺寸與內部尺寸的差異（包含有蓋容器、厚度的概念）。"
